<?xml version="1.0" encoding="utf-8"?>
<xs:schema attributeFormDefault="unqualified" elementFormDefault="qualified" xmlns:xs="http://www.w3.org/2001/XMLSchema">
  <xs:element name="articles">
    <xs:complexType>
      <xs:sequence>
        <xs:element maxOccurs="unbounded" name="article">
          <xs:complexType>
            <xs:sequence>
              <xs:element name="categories">
                <xs:complexType>
                  <xs:sequence>
                    <xs:element maxOccurs="unbounded" name="category">
                      <xs:complexType>
                        <xs:attribute name="id" type="xs:string" use="required" />
                      </xs:complexType>
                    </xs:element>
                  </xs:sequence>
                </xs:complexType>
              </xs:element>
              <xs:element name="authors">
                <xs:complexType>
                  <xs:sequence>
                    <xs:element maxOccurs="unbounded" name="author">
                      <xs:complexType>
                        <xs:attribute name="id" type="xs:string" use="required" />
                      </xs:complexType>
                    </xs:element>
                  </xs:sequence>
                </xs:complexType>
              </xs:element>
              <xs:element name="creation_timestamp">
                <xs:complexType>
                  <xs:attribute name="year" type="xs:unsignedShort" use="required" />
                  <xs:attribute name="month" type="xs:unsignedByte" use="required" />
                  <xs:attribute name="day" type="xs:unsignedByte" use="required" />
                  <xs:attribute name="hours" type="xs:unsignedByte" use="required" />
                  <xs:attribute name="minutes" type="xs:unsignedByte" use="required" />
                  <xs:attribute name="seconds" type="xs:unsignedByte" use="required" />
                </xs:complexType>
              </xs:element>
              <xs:element name="title" type="xs:string" />
              <xs:element name="content">
                <xs:complexType>
                  <xs:sequence>
                    <xs:element maxOccurs="unbounded" name="p">
                      <xs:complexType mixed="true">
                        <xs:sequence minOccurs="0">
                          <xs:element maxOccurs="unbounded" name="a">
                            <xs:complexType>
                              <xs:simpleContent>
                                <xs:extension base="xs:string">
                                  <xs:attribute name="href" type="xs:string" use="required" />
                                </xs:extension>
                              </xs:simpleContent>
                            </xs:complexType>
                          </xs:element>
                        </xs:sequence>
                      </xs:complexType>
                    </xs:element>
                  </xs:sequence>
                </xs:complexType>
              </xs:element>
            </xs:sequence>
          </xs:complexType>
        </xs:element>
      </xs:sequence>
    </xs:complexType>
  </xs:element>
</xs:schema>